{
  "source": {
    "width": 736,
    "height": 1104
  },
  "regions": [
    {
      "id": "page",
      "role": "page",
      "bbox": {
        "x": 0,
        "y": 0,
        "width": 736,
        "height": 1104
      }
    }
  ],
  "layout": {
    "direction": "column"
  },
  "hierarchy": {
    "root": "root",
    "children": {
      "root": [
        "header",
        "heroSection",
        "shopByCategory",
        "loyaltyProgram",
        "bestSellers"
      ]
    }
  },
  "elements": [
    {
      "id": "header",
      "kind": "navBar",
      "text": "PURELIS BEAUTY",
      "regionId": "page",
      "bbox": {
        "x": 30,
        "y": 45,
        "width": 126,
        "height": 28
      },
      "geometrySource": "vlm",
      "certainty": "high"
    },
    {
      "id": "heroSection",
      "kind": "section",
      "text": "Good for your skin. Better for you.",
      "regionId": "page",
      "bbox": {
        "x": 58,
        "y": 149,
        "width": 302,
        "height": 76
      },
      "geometrySource": "vlm",
      "certainty": "high"
    },
    {
      "id": "shopByCategory",
      "kind": "section",
      "text": "Shop by Category",
      "regionId": "page",
      "bbox": {
        "x": 41,
        "y": 553,
        "width": 196,
        "height": 28
      },
      "geometrySource": "vlm",
      "certainty": "high"
    },
    {
      "id": "loyaltyProgram",
      "kind": "section",
      "text": "Good choices deserve rewards.",
      "regionId": "page",
      "bbox": {
        "x": 65,
        "y": 774,
        "width": 172,
        "height": 38
      },
      "geometrySource": "vlm",
      "certainty": "high"
    },
    {
      "id": "bestSellers",
      "kind": "section",
      "text": "Best Sellers",
      "regionId": "page",
      "bbox": {
        "x": 43,
        "y": 912,
        "width": 106,
        "height": 28
      },
      "geometrySource": "vlm",
      "certainty": "high"
    }
  ],
  "layoutRelations": [
    {
      "type": "above",
      "source": "header",
      "target": "heroSection",
      "distance": 10
    },
    {
      "type": "above",
      "source": "heroSection",
      "target": "shopByCategory",
      "distance": 25
    },
    {
      "type": "above",
      "source": "shopByCategory",
      "target": "loyaltyProgram",
      "distance": 30
    },
    {
      "type": "above",
      "source": "loyaltyProgram",
      "target": "bestSellers",
      "distance": 25
    }
  ],
  "uncertainObservations": []
}
