{
  "source": {
    "width": 1440,
    "height": 900
  },
  "regions": [
    {
      "id": "header",
      "role": "top navigation",
      "bbox": {
        "x": 0,
        "y": 0,
        "width": 1440,
        "height": 112
      }
    },
    {
      "id": "hero",
      "role": "centered content",
      "bbox": {
        "x": 320,
        "y": 230,
        "width": 800,
        "height": 320
      }
    }
  ],
  "layout": {
    "direction": "column",
    "horizontalAlignment": "center",
    "gap": 32,
    "padding": {
      "top": 40,
      "right": 72,
      "bottom": 72,
      "left": 72
    },
    "notes": [
      "Centered hero",
      "Wide whitespace"
    ]
  },
  "hierarchy": {
    "root": "page",
    "children": {
      "page": [
        "header",
        "hero"
      ],
      "header": [
        "brand",
        "nav",
        "header-cta"
      ],
      "hero": [
        "title",
        "subtitle",
        "search",
        "tags"
      ]
    }
  },
  "elements": [
    {
      "id": "brand",
      "kind": "text",
      "text": "Atlas",
      "regionId": "header",
      "bbox": {
        "x": 72,
        "y": 48,
        "width": 60,
        "height": 29
      },
      "geometrySource": "vlm",
      "certainty": "high"
    },
    {
      "id": "nav",
      "kind": "navigation",
      "regionId": "header",
      "bbox": {
        "x": 1080,
        "y": 42,
        "width": 288,
        "height": 44
      },
      "geometrySource": "vlm",
      "certainty": "medium"
    },
    {
      "id": "header-cta",
      "kind": "button",
      "text": "Get started",
      "regionId": "header",
      "bbox": {
        "x": 1230,
        "y": 42,
        "width": 138,
        "height": 44
      },
      "geometrySource": "vlm",
      "certainty": "high"
    },
    {
      "id": "title",
      "kind": "heading",
      "text": "Find your next idea",
      "regionId": "hero",
      "bbox": {
        "x": 452,
        "y": 245,
        "width": 536,
        "height": 64
      },
      "geometrySource": "vlm",
      "certainty": "high"
    },
    {
      "id": "subtitle",
      "kind": "text",
      "regionId": "hero",
      "bbox": {
        "x": 482,
        "y": 320,
        "width": 476,
        "height": 24
      },
      "geometrySource": "vlm",
      "certainty": "medium"
    },
    {
      "id": "search",
      "kind": "input",
      "regionId": "hero",
      "bbox": {
        "x": 390,
        "y": 390,
        "width": 660,
        "height": 64
      },
      "geometrySource": "vlm",
      "certainty": "high",
      "visualRole": "primary-control"
    },
    {
      "id": "tag-design",
      "kind": "chip",
      "text": "Design",
      "regionId": "hero",
      "bbox": {
        "x": 532,
        "y": 486,
        "width": 105,
        "height": 38
      },
      "geometrySource": "vlm",
      "certainty": "high"
    },
    {
      "id": "tag-development",
      "kind": "chip",
      "text": "Development",
      "regionId": "hero",
      "bbox": {
        "x": 651,
        "y": 486,
        "width": 138,
        "height": 38
      },
      "geometrySource": "vlm",
      "certainty": "high"
    },
    {
      "id": "tag-writing",
      "kind": "chip",
      "text": "Writing",
      "regionId": "hero",
      "bbox": {
        "x": 803,
        "y": 486,
        "width": 105,
        "height": 38
      },
      "geometrySource": "vlm",
      "certainty": "high"
    }
  ],
  "layoutRelations": [
    {
      "type": "below",
      "source": "subtitle",
      "target": "title",
      "distance": 11
    },
    {
      "type": "below",
      "source": "search",
      "target": "subtitle",
      "distance": 46
    },
    {
      "type": "aligned-center",
      "source": "search",
      "target": "hero"
    }
  ],
  "visualTokens": {
    "colors": {
      "background": "#f8fafc",
      "text": "#0f172a",
      "primary": "#2563eb"
    },
    "typography": {
      "heading": "56px/1.1 700",
      "body": "16px/1.5 400"
    },
    "spacing": {
      "page": "72px",
      "section": "48px"
    },
    "radius": {
      "control": "14px",
      "pill": "9999px"
    }
  },
  "uncertainObservations": []
}
