{
  "source": {
    "width": 736,
    "height": 1104
  },
  "regions": [
    {
      "id": "page",
      "role": "page",
      "bbox": {
        "x": 0,
        "y": 0,
        "width": 736,
        "height": 1104
      }
    }
  ],
  "layout": {
    "direction": "column"
  },
  "hierarchy": {
    "root": "root",
    "children": {
      "root": [
        "header",
        "mainContent",
        "page"
      ],
      "page": [
        "header",
        "mainContent"
      ]
    }
  },
  "elements": [
    {
      "id": "header",
      "kind": "header",
      "text": "PURELIS BEAUTY",
      "regionId": "page",
      "bbox": {
        "x": 36,
        "y": 40,
        "width": 125,
        "height": 28
      },
      "geometrySource": "vlm",
      "certainty": "high",
      "visual": {}
    },
    {
      "id": "mainContent",
      "kind": "section",
      "regionId": "page",
      "bbox": {
        "x": 0,
        "y": 145,
        "width": 736,
        "height": 928
      },
      "geometrySource": "vlm",
      "certainty": "low",
      "visual": {}
    }
  ],
  "layoutRelations": [
    {
      "type": "above",
      "source": "header",
      "target": "mainContent"
    }
  ],
  "uncertainObservations": []
}
